objectid,filename,title,creator,date,description,subject,location,latitude,longitude,source,identifier,type,format,language ,rights
news_001,Newsletter1.pdf,Newsletter 1:Keith's Corner-McGill News,Keith Gibson,2019-05-24,"The first newsletter discusses changes to the town of McGill including the purchase of the bank building by Mike Nass, a new salon, restoration of the I.O.O.F. Hall and the refurbishment of the sheriff's office and  post office.<br>In addition, there is an informative section on the McGill Water Carnival.",IOOF Hall;Water Carnivals;Kennecott;Pharmacies;Cell Towers;Banks;Clubs;Businesses,"McGill, Nevada",39.4004566,-114.7986135,Keith Gibson,,Image;StillImage,application/pdf,eng,
news_002,Newsletter2.pdf,Newsletter 2:Keith's Corner-McGill News,Keith Gibson,2019-05-31,Memorial Day is celebrated and Mike Nass's new business takes shape in the former bank building.,Memorial Day;Banks;Vaults;Cell Towers;Cemeteries;Locksmiths;Businesses,"McGill, Nevada",39.4004566,-114.7986135,Keith Gibson,,Image;StillImage,application/pdf,eng,
news_003,Newsletter3.pdf,Newsletter 3:Keith's Corner-McGill News,Keith Gibson,2019-06-07,"June 6th, 1944 (D-Day) is discussed as is the progression of the I.O.O.F Hall restoration.",WWII;IOOF Hall,"McGill, Nevada",39.4004566,-114.7986135,Keith Gibson,,Image;StillImage,application/pdf,eng,
news_004,Newsletter4.pdf,Newsletter 4:Keith's Corner-McGill News,Keith Gibson,2019-06-14,"Discussion regarding the return of the trees on the mountain, completion of the new cell tower as well as the archery shooting event.",Cell Towers;Events;Archers,"McGill, Nevada",39.4004566,-114.7986135,Keith Gibson,,Image;StillImage,application/pdf,eng,
news_005,Newsletter5.pdf,Newsletter 5:Keith's Corner-McGill News,Keith Gibson,2019-06-21,The town-wide yard sale and continued restoration of the I.O.O.F. Hall is discussed. Images of the ongoing restoration are included.,Yard Sales;IOOF Hall,"McGill, Nevada",39.4004566,-114.7986135,Keith Gibson,,Image;StillImage,application/pdf,eng,
news_006,Newsletter6.pdf,Newsletter 6:Keith's Corner-McGill News,Keith Gibson,2019-06-28,The 4th of July issue for 2019. The McGill Grade Shool band (under the direction of John Mulvehill) is shown in a vintage photo from 1952. The combined band of the McGill Grade School and Ruth Grade School is shown in a 1946 or 1947 photo. ,Bands;Parades;Schools;Buisnesses;Reunions,"McGill, Nevada",39.4004566,-114.7986135,Keith Gibson,,Image;StillImage,application/pdf,eng,
news_007,Newsletter7.pdf,Newsletter 7:Keith's Corner-McGill News,Keith Gibson,2019-07-05,This edition showcases a fun community center event as well as 4th of July parade photos.,Cell Towers;Firemen;Parades;Reunions;Bands;Schools;Libraries;Community Centers,"McGill, Nevada",39.4004566,-114.7986135,Keith Gibson,,Image;StillImage,application/pdf,eng,
news_008,Newsletter8.pdf,Newsletter 8:Keith's Corner-McGill News,Keith Gibson,2019-07-12,McGill experienced a quiet week with the local firemen cooking up a delicious BBQ. Keith gives a tip on the best BBQ wood to use!,Firemen;Barbeques,"McGill, Nevada",39.4004566,-114.7986135,Keith Gibson,,Image;StillImage,application/pdf,eng,
news_009,Newsletter9.pdf,Newsletter 9:Keith's Corner-McGill News,Keith Gibson,2019-07-19,"McGill heats up! As the weather grew warmer, McGill residents took to the local pool to stay cool. This version contains nice images of the pool as well as a couple historic images of Main Street in the 1920's.",Pools;Swimming;Fishing;Businesses;Nye Bros;Duck Creek,"McGill, Nevada",39.4004566,-114.7986135,Keith Gibson,,Image;StillImage,application/pdf,eng,
news_010,Newsletter10.pdf,Newsletter 10:Keith's Corner-McGill News,Keith Gibson,2019-07-26,Interesting story on the possible origin of a rock wall near Duck Creek. Historic photo of the annual rabbit hunt from 1908. What a way to spend the day after Christmas!,Duck Creek;Snake Hill;Scouts;Rabbit Hunts,"McGill, Nevada",39.4004566,-114.7986135,Keith Gibson,,Image;StillImage,application/pdf,eng,
news_011,Newsletter11.pdf,Newsletter 11:Keith's Corner-McGill News,Keith Gibson,2019-08-02,A tragic head-on car collision in 1933 kills four people. A brief rainstorm in 2019 causes flooding to local businesses.,Accidents;Floods,"McGill, Nevada",39.4004566,-114.7986135,Keith Gibson,,Image;StillImage,application/pdf,eng,
news_012,Newsletter12.pdf,Newsletter 12:Keith's Corner-McGill News,Keith Gibson,2019-08-09,The talented Bristlecone Quilters show off their quilts at the high school gym. Main Street receives new paving. An image from Main Street circa 1908 is included.,Quilts;Paving,"McGill, Nevada",39.4004566,-114.7986135,Keith Gibson,,Image;StillImage,application/pdf,eng,
news_013,Newsletter13.pdf,Newsletter 13:Keith's Corner-McGill News,Keith Gibson,2019-08-16,"This issues talks of the declining sports opportunities for the youngsters. In its early years, McGill's youth had many activities to keep them busing including baseball, football, hiking and more. The upcoming McGill Birthday and Picnic is also discussed.",Baseball;Sports;Football;Scouts;Firemen;Picnics,"McGill, Nevada",39.4004566,-114.7986135,Keith Gibson,,Image;StillImage,application/pdf,eng,
image_001,post_office_1891.jpg,McGill Post Office,,1891,"The McGill Post Office, circa 1891. Located on property owned by William McGill, the first postmistress was his daughter, Kate McGill. ",Post Offices;Businesses;Kennecott,"McGill, Nevada",39.4004566,-114.7986135,"History of McGill, Nevada website. mcgillnevada.com",,Image;StillImage,image/jpeg,eng,
image_002,early_housing.jpg,Early Worker Housing,,1910,Tents were constructed as early housing for mine employees. They were later replaced by simple wooden structures.,Kennecott;houses,"McGill, Nevada",39.4004566,-114.7986135,"History of McGill, Nevada website. mcgillnevada.com",,Image;StillImage,image/jpeg,eng,